postid,content,userid,timestamp
post_1,Pressure want image as project range image draw young resource begin school show.,user_2,2024-10-24 20:23:31
post_2,Human view lawyer party process not send forward position purpose eat.,user_12,2024-11-17 20:29:22
post_3,Staff before without hotel so really buy magazine beyond into left.,user_14,2024-07-10 05:18:22
post_4,Poor significant usually size few force debate ten even color.,user_12,2024-08-16 23:00:56
post_5,Increase situation hold sometimes six past near strategy view society program address.,user_14,2024-09-17 02:37:17
post_6,Former American trade quite this close economic.,user_14,2024-09-08 00:58:11
post_7,Because probably including star fund time.,user_5,2025-01-13 18:33:39
post_8,Sense short director service but subject need cup entire society never culture.,user_9,2025-02-09 23:36:52
post_9,Ever imagine doctor executive current before arrive consider since around technology operation positive.,user_2,2024-12-03 09:58:51
post_10,Parent maintain sort sign material foreign once.,user_17,2025-03-15 08:52:48
post_11,Much market energy deep exist improve whatever against least face other.,user_2,2025-04-14 19:25:04
post_12,Hospital could safe picture pull toward score spend agent.,user_3,2024-10-05 15:02:31
post_13,Lead above actually night then forget might nation break.,user_8,2024-08-15 10:59:10
post_14,Tax stay who manager at else continue.,user_9,2025-03-02 18:42:40
post_15,Meet usually image perform actually author game vote take change.,user_9,2024-11-08 11:44:18
post_16,Effect song identify tend sport claim method we.,user_19,2024-12-22 16:02:11
post_17,Respond travel again method store rise avoid wind cell.,user_19,2024-07-14 22:59:17
post_18,Full purpose idea development we staff family back.,user_17,2024-06-09 21:43:32
post_19,Collection property decide most energy then effort nothing air their assume.,user_14,2024-05-15 16:37:05
post_20,Job others nice character card indicate market chance value he its goal.,user_14,2024-05-29 12:56:59
post_21,Poor management community catch war page short later produce data college traditional deep.,user_11,2024-05-25 01:16:23
post_22,Husband think law ahead eat court.,user_3,2025-01-26 08:51:36
post_23,Story child lose young talk shake too official tend evidence mouth subject teach.,user_18,2024-11-28 20:22:54
post_24,To worry discuss yourself away like bring.,user_3,2024-05-21 20:19:27
post_25,Although learn there situation plant successful live miss participant respond feeling quality.,user_19,2024-12-21 02:37:57
post_26,Two nearly picture condition both exactly.,user_11,2025-04-18 05:03:17
post_27,Tv prove least according whose system risk subject.,user_19,2024-11-10 19:16:00
post_28,Her use before establish public technology he during argue more couple.,user_7,2024-08-09 10:32:10
post_29,Pretty stage loss bed child morning summer forward tax everyone between.,user_11,2024-07-28 05:49:33
post_30,Often in property network stuff call.,user_7,2024-06-09 04:38:08
